Ontology ID	Label	editor preferred term	has curation status	alternative term	definition	definition source	example of usage	editor note	term editor	curator note	ontology term requester	term tracker item	Parent	Logic Axioms
ID	AL rdfs:label@en	AL editor preferred term@en	AI has curation status	AL alternative term@en SPLIT=|	AL definition@en	A definition source SPLIT=|	AL example of usage@en SPLIT=|	AL editor note@en SPLIT=|	A term editor SPLIT=|	AL curator note@en SPLIT=|	A ontology term requester	AI term tracker item	C % SPLIT=|	C % SPLIT=|
IAO:0000701	descriptive data section	descriptive data section	metadata complete		"A document part that lists and defines data variables, describes data characteristics (e.g. missing data information) and any assumptions and simplifications made."	https://www.equator-network.org/reporting-guidelines/prisma/			PERSON: Chen Yang|PERSON: Jie Zheng		ONE ontology	https://github.com/information-artifact-ontology/IAO/issues/235	document part	
IAO:0000702	additional results section	additional results section	metadata complete		"A results section that reports analyses other than main results of the study (e.g. subgroups analyses, adjusted analyses, sensitivity analyses, etc.)"	https://www.equator-network.org/reporting-guidelines/strobe/|https://www.equator-network.org/reporting-guidelines/consort/|https://www.equator-network.org/reporting-guidelines/prisma/			PERSON: Chen Yang|PERSON: Jie Zheng		ONE ontology	https://github.com/information-artifact-ontology/IAO/issues/235	results section	
IAO:0000703	research participants section	research participants section	metadata complete		"A document part that describes human subject(s) that participated in a study (e.g. inclusion & exclusion criteria, recruitment methods, reasons for non-participation, grouping and randomisation, methods of follow-up, etc.)."	https://www.equator-network.org/reporting-guidelines/consort/|https://www.equator-network.org/reporting-guidelines/strobe-nut/|https://www.equator-network.org/reporting-guidelines/prisma/			PERSON: Chen Yang|PERSON: Jie Zheng		ONE ontology	https://github.com/information-artifact-ontology/IAO/issues/235	document part	
IAO:0000704	measurement methods section	measurement methods section	metadata complete		A methods section that describes details of data assessment methods (data measurement).	https://www.equator-network.org/reporting-guidelines/strobe/			PERSON: Chen Yang|PERSON: Jie Zheng		ONE ontology	https://github.com/information-artifact-ontology/IAO/issues/235	methods section	
IAO:0000705	research settings section	research settings section	metadata complete		A document part that describes the physical/social/cultural conditions around a research trial.	https://www.ncbi.nlm.nih.gov/books/NBK262175/			PERSON: Chen Yang|PERSON: Jie Zheng		ONE ontology	https://github.com/information-artifact-ontology/IAO/issues/235	document part	
IAO:0000706	study bias section	study bias section	metadata complete		A study limitations section that describes systematic error introduced into sampling or testing by selecting or encouraging one outcome or answer over others.	DOI: 10.1097/PRS.0b013e3181de24bc			PERSON: Chen Yang|PERSON: Jie Zheng		ONE ontology	https://github.com/information-artifact-ontology/IAO/issues/235	study limitations section	
IAO:0000707	graphical abstract	graphical abstract	metadata complete	visual abstract	An abstract that is pictorial summary of the main findings described in the document.	https://www.elsevier.com/authors/journal-authors/graphical-abstract			PERSON: Tim Beck|PERSON: Jie Zheng		Biomedical literature NLP project 	https://github.com/information-artifact-ontology/IAO/issues/234	abstract	